{
  "$schema": "https://json-schema.org/draft/2020-12/schema",
  "$id": "https://muxui.dev/schema/guide.schema.json",
  "title": "Mux UI guide",
  "type": "object",
  "additionalProperties": false,
  "required": ["schemaVersion", "id", "kind", "name", "summary", "lifecycle", "keywords", "platforms", "source"],
  "properties": {
    "schemaVersion": { "const": "1.0.0" },
    "id": { "type": "string", "pattern": "^muxui:guide:[a-z0-9]+(?:-[a-z0-9]+)*$" },
    "kind": { "const": "guide" },
    "name": { "type": "string", "minLength": 1 },
    "summary": { "type": "string", "minLength": 1 },
    "lifecycle": { "enum": ["experimental", "stable", "deprecated", "removed"] },
    "keywords": { "type": "array", "items": { "type": "string", "minLength": 1 }, "uniqueItems": true },
    "platforms": { "type": "array", "items": { "enum": ["web.html", "web.react", "native.react-native", "native.react-native-web"] }, "uniqueItems": true },
    "source": { "type": "string", "pattern": "^(?!/)(?!.*(?:^|/)\\.\\.(?:/|$))[a-zA-Z0-9._/-]+$" },
    "extensions": { "type": "object", "propertyNames": { "pattern": "^muxui\\.experimental\\.[a-z0-9]+(?:-[a-z0-9]+)*$" }, "additionalProperties": true }
  }
}
