{"schemaVersion":"1.0.0","id":"muxui:guide:number-field-usage","kind":"guide","name":"NumberField usage","summary":"Use NumberField through the Mux UI React binding.","lifecycle":"experimental","keywords":["number-field","react","forms"],"platforms":["web.react"],"source":"catalog/guides/number-field-usage.md"}
