{"schemaVersion":"1.0.0","id":"core:guide:checkbox-group-usage","kind":"guide","name":"CheckboxGroup usage","summary":"Use CheckboxGroup through the Core React binding.","lifecycle":"experimental","keywords":["checkbox-group","react","forms"],"platforms":["web.react"],"source":"catalog/guides/checkbox-group-usage.md"}
