{"schemaVersion":"1.0.0","id":"core:guide:file-trigger-usage","kind":"guide","name":"FileTrigger usage","summary":"Portable usage guidance for FileTrigger.","lifecycle":"experimental","keywords":["file-trigger","files","react"],"platforms":["web.react"],"source":"catalog/guides/file-trigger-usage.md"}
