{"schemaVersion":"1.0.0","id":"core:guide:toggle-button-group-usage","kind":"guide","name":"ToggleButtonGroup usage","summary":"Portable usage guidance for ToggleButtonGroup.","lifecycle":"experimental","keywords":["toggle-button-group","react","accessibility"],"platforms":["web.react"],"source":"catalog/guides/toggle-button-group-usage.md"}
