{"schemaVersion":"1.0.0","id":"core:guide:date-picker-usage","kind":"guide","name":"DatePicker usage","summary":"Use DatePicker through the Core React binding.","lifecycle":"experimental","keywords":["date-picker","react","forms"],"platforms":["web.react"],"source":"catalog/guides/date-picker-usage.md"}
