{"schemaVersion":"1.0.0","id":"muxui:guide:autocomplete-usage","kind":"guide","name":"Autocomplete usage","summary":"Use Autocomplete through the Mux UI React binding.","lifecycle":"experimental","keywords":["autocomplete","react","forms"],"platforms":["web.react"],"source":"catalog/guides/autocomplete-usage.md"}
