{"schemaVersion":"1.0.0","id":"muxui:guide:time-field-usage","kind":"guide","name":"TimeField usage","summary":"Use TimeField through the Mux UI React binding.","lifecycle":"experimental","keywords":["time-field","react","forms"],"platforms":["web.react"],"source":"catalog/guides/time-field-usage.md"}
