{"schemaVersion":"1.0.0","id":"muxui:guide:color-swatch-picker-usage","kind":"guide","name":"ColorSwatchPicker usage","summary":"Portable usage guidance for ColorSwatchPicker.","lifecycle":"experimental","keywords":["color","swatch","picker","react"],"platforms":["web.react"],"source":"catalog/guides/color-swatch-picker-usage.md"}
